{
  "schema_version": 2,
  "task_id": "T10",
  "measurement_scope": "single_pe",
  "measurement_status": "three_seed_single_pe",
  "toolchain": {
    "yosys": "Yosys 0.69+150 (git sha1 0d3483f04-dirty, Release, Clang /usr/bin/clang++ 21.1.8)",
    "openroad": "26Q2-1164-g08f67ee5ec",
    "orfs_revision": "1ec57da7bf0f1491190cbea2673c2c01fb3bc3ae",
    "asap7_manifest_sha256": "724f3888411a123ff464a9d021cf6cb4dfcd96283c706a8bb5ade7549def7aec",
    "evaluator_sha256": "5b5ea036dfea6cc5a7967b4fe081c8298078345dbd2e795d89a78f4e6bef8557",
    "orfs_compat_patch_sha256": "367813ab8dd21130a73be148923223295c2fb4eca19baf1fb8f782ffb2dcee8c"
  },
  "parameter_set": {
    "platform": "ASAP7_7p5t_RVT_NLDM",
    "period_ps": 1000,
    "corner": "WC",
    "utilization": 24,
    "density": 0.24,
    "seeds": [
      11,
      29,
      47
    ],
    "signal_routing_layers": "M2-M7",
    "clock_routing_layers": "M6-M7"
  },
  "workload": {
    "id": "T10-power-v1",
    "matrix_blocks": 200,
    "sha256": "455db278312d5d8c30ee706216f5f446bca7f36aed42273bd172010c8f98cc2a",
    "oracle_sha256": "880a56317f3b54ea6b9f563ad2e6272d54e2332986bfd09780b25aa0a3aa57e7"
  },
  "source": {
    "rtl_sha256": "576afc80af06e936089fd8f841fbcc4f555cee254bfa1922f701296e1d092b8e",
    "filelist_sha256": "8ffa4b5e1bdbead2fd7a99dccfb169562cf0e1f7dfecaa3d7bd1426dd03c441a",
    "structure_report_sha256": "71e7f756f9479aabc0f20153940b93a4fcf37b9ab445ad3ef008c707c0bb55d7",
    "pe_rtl_sha256": "a1e591b619a37c5ea83db497607923a480b44916fcf422172809113796ed8337",
    "pe_module": "t10_reference_pe",
    "hierarchy": {
      "tile_instances": 16,
      "pe_instances_per_tile": 16,
      "pe_instances_total": 256
    },
    "legacy_component_audit_sha256": "1f33a96f7af148ed0f2850105d5547d1e889fb50b304f25eed6403ee456e4080"
  },
  "per_seed": [
    {
      "layout_seed": 11,
      "levels": {
        "pe": {
          "area_um2": 60069.8,
          "setup_worst_slack_ps": 22.243984,
          "hold_worst_slack_ps": 18.91387,
          "drc_violations": 0,
          "artifacts": {
            "odb": {
              "path": "/mnt/ubu_3T/ic_bcmk_scratch/t10_v15_manual/all_manual_verify/v15_manual_final.odb",
              "bytes": 290531287,
              "sha256": "e690f0f977270b546c50c9a56d278f5ac9e30f8dbe336a76406a6546f0f06741"
            },
            "sdc": {
              "path": "/mnt/ubu_3T/ic_bcmk_scratch/t10_v15_manual/all_manual_verify/v15_manual_final.sdc",
              "bytes": 40901,
              "sha256": "176292a6101fff0e2836805feef511ddd98fa71127417b59a3530ad0da66cff7"
            },
            "spef": {
              "path": "/mnt/ubu_3T/ic_bcmk_scratch/t10_v15_manual/all_manual_verify/v15_manual_final.spef",
              "bytes": 105406843,
              "sha256": "22edeafff9e74317b0891631ac68c6427ee719a731f0c76e6a6fa9014d350c51"
            },
            "netlist": {
              "path": "/mnt/ubu_3T/ic_bcmk_orfs_asap7/flow/results/asap7/t10_reference_pe/ic_t10_frozen_pe_exact_v15_margin_escape_m7_wc_p1000_seed11/6_final.v",
              "bytes": 6473863,
              "sha256": "0f515592e691198d304cda4acf462a8aca1434781dcb13aacd8b141a1109d20c"
            },
            "timing_report": {
              "path": "/mnt/ubu_3T/ic_bcmk_scratch/t10_v1_three_seed/seed11_physical_verification/pe/block.json",
              "bytes": 7263,
              "sha256": "9b9908e7e1ade57701fbfa9ae3b023ab9817d2ab14f197283fabeaf24ecc6448"
            },
            "drc_report": {
              "path": "/mnt/ubu_3T/ic_bcmk_scratch/t10_v1_three_seed/seed11_physical_verification/pe/final_drc.rpt",
              "bytes": 0,
              "sha256": "e3b0c44298fc1c149afbf4c8996fb92427ae41e4649b934ca495991b7852b855"
            },
            "constraint_report": {
              "path": "/mnt/ubu_3T/ic_bcmk_scratch/t10_v1_three_seed/seed11_physical_verification/pe/constraint_coverage.rpt",
              "bytes": 0,
              "sha256": "e3b0c44298fc1c149afbf4c8996fb92427ae41e4649b934ca495991b7852b855"
            },
            "connectivity_report": {
              "path": "/mnt/ubu_3T/ic_bcmk_scratch/t10_v1_three_seed/seed11_physical_verification/pe/geometric_connectivity.json",
              "bytes": 540,
              "sha256": "2f3e78a1f2b3cef50be3347185f61141c73670938b4ab8dbd88145b0e9abd723"
            },
            "electrical_report": {
              "path": "/mnt/ubu_3T/ic_bcmk_scratch/t10_v1_three_seed/seed11_physical_verification/pe/electrical.rpt",
              "bytes": 63733,
              "sha256": "cbfc359d1c2175915c231d3e4aab7453eba3acc8842a9397d50b0242400ddb58"
            },
            "drc_raw_report": {
              "path": "/mnt/ubu_3T/ic_bcmk_scratch/t10_v1_three_seed/seed11_physical_verification/pe/final_drc.rpt.raw",
              "bytes": 80360,
              "sha256": "b1573fd68b6256742a6cd5ddda79f0409df9fb879cbd10e9760decbeffb0e931"
            },
            "drc_log": {
              "path": "/mnt/ubu_3T/ic_bcmk_scratch/t10_v1_three_seed/seed11_physical_verification/pe/drc.log",
              "bytes": 3697,
              "sha256": "503c460e7ddeb1ed372fe03ce330c25b73b2a3382f36dd2f95dfdf8deeade635"
            },
            "full_geometry": {
              "path": "/mnt/ubu_3T/ic_bcmk_scratch/t10_v1_three_seed/seed11_full_geometry/full_geometry.json",
              "bytes": 1629,
              "sha256": "d96a334e19ac9be5960db23bc9f5953152edb0a8494fe76df626eb98886d5ef4"
            },
            "full_connectivity": {
              "path": "/mnt/ubu_3T/ic_bcmk_scratch/t10_v1_three_seed/seed11_full_geometry/pe.json",
              "bytes": 794,
              "sha256": "210f7ea8a3735f96456b155db6a167597131685fc5edae8e24d763236e74c9fc"
            }
          }
        }
      },
      "area_um2": 60069.8,
      "delay_ps": 977.756016,
      "power": {
        "task_id": "T10",
        "measurement_scope": "single_pe",
        "layout_seed": 11,
        "status": "single_seed_activity_power_qualified_not_three_seed_baseline",
        "power_corner": "TT",
        "workload_id": "T10-power-v1",
        "matrix_blocks": 200,
        "activity_annotation_fraction": 0.9830287802649612,
        "vcd_window_seconds": 1.7299e-06,
        "activity_format": "SAIF",
        "instance_weights": {
          "pe": 1
        },
        "components_w": {
          "pe_shell": 0.03001901694,
          "internal_macros": 0.066566777176
        },
        "total_power_w": 0.096585794116,
        "energy_j_per_block": 8.35418826206342e-10,
        "components": [
          {
            "instance": "pe_shell",
            "master": "t10_reference_pe",
            "scope": "pe",
            "power_w": 0.03001901694,
            "total_reported_w": 0.03001901694,
            "macro_reported_w": 0.0,
            "activity_annotation_fraction": 0.9967019490647585,
            "sequential_activity_annotation_fraction": 1.0,
            "activity_import": {
              "policy": "exact_physical_net_connected_pin_activity_v1",
              "scope": [
                "pe"
              ],
              "activity_nets": 60649
            },
            "activity_net_data_sha256": "e3ffa2b213c8302403c67d78f2856fdf69e0a4c9defed573f0e29071f74c79a7",
            "artifacts": {
              "odb": {
                "path": "/mnt/ubu_3T/ic_bcmk_scratch/t10_v15_manual/all_manual_verify/v15_manual_final.odb",
                "bytes": 290531287,
                "sha256": "e690f0f977270b546c50c9a56d278f5ac9e30f8dbe336a76406a6546f0f06741"
              },
              "sdc": {
                "path": "/mnt/ubu_3T/ic_bcmk_scratch/t10_v15_manual/all_manual_verify/v15_manual_final.sdc",
                "bytes": 40901,
                "sha256": "176292a6101fff0e2836805feef511ddd98fa71127417b59a3530ad0da66cff7"
              },
              "spef": {
                "path": "/mnt/ubu_3T/ic_bcmk_scratch/t10_v15_manual/all_manual_verify/v15_manual_final.spef",
                "bytes": 105406843,
                "sha256": "22edeafff9e74317b0891631ac68c6427ee719a731f0c76e6a6fa9014d350c51"
              }
            },
            "report_path": "/mnt/ubu_3T/ic_bcmk_scratch/t10_v1_three_seed/seed11_power/pe_shell/power.log",
            "report_sha256": "14ef4db77478d571a5d1a5fa0276d136981096cbda5a2c4bea808b3ac563d1a8"
          },
          {
            "instance": "cpa_postprocess",
            "master": "t10_reference_cpa_postprocess",
            "scope": "pe/cpa_postprocess",
            "power_w": 0.01036695577,
            "total_reported_w": 0.01036695577,
            "macro_reported_w": 0.0,
            "activity_annotation_fraction": 0.9887238369847849,
            "sequential_activity_annotation_fraction": 1.0,
            "activity_import": {
              "policy": "exact_physical_net_connected_pin_activity_v1",
              "scope": [
                "pe",
                "cpa_postprocess"
              ],
              "activity_nets": 34692
            },
            "activity_net_data_sha256": "7101eec8397ec48e051c04ffe1b97ada89013ed83873728a94db69f1a4447106",
            "artifacts": {
              "odb": {
                "path": "/mnt/ubu_3T/ic_bcmk_orfs_asap7/flow/results/asap7/t10_reference_cpa_postprocess/ic_t10_frozen_cpa_postprocess_exact_v2_m7_wc_p1000_seed11/6_final.odb",
                "bytes": 60844306,
                "sha256": "d73775ef94c0e574d5fb5f052208f560905dbf963f4db5606988790b45265780"
              },
              "sdc": {
                "path": "/mnt/ubu_3T/ic_bcmk_orfs_asap7/flow/results/asap7/t10_reference_cpa_postprocess/ic_t10_frozen_cpa_postprocess_exact_v2_m7_wc_p1000_seed11/6_final.sdc",
                "bytes": 121336,
                "sha256": "edce77aa4fe329ec00d51cba2f2cc876702718bb3268958e48f07d13b7165437"
              },
              "spef": {